{
  "sample_name": "example_sample",
  "anchors": [
    {
      "name": "adapter_5p",
      "type": "fixed",
      "sequence": "ACGTACGT",
      "max_mismatches": 1
    },
    {
      "name": "polyT",
      "type": "regex",
      "pattern": "T{6,}"
    }
  ],
  "structure": {
    "expected_order": ["adapter_5p", "polyT"]
  },
  "thresholds": {
    "long_read_min_bp": 20,
    "long_read_min_q": 20,
    "heatmap_max_reads": 100
  }
}
